{
  "schema_version": 1,
  "qr_id": "generated-theme",
  "payload_type": "url",
  "payload": "https://example.com/menu?source=generated-theme",
  "output": {"format": "png", "scale": 8, "border": 4, "width": 1400, "height": 1000},
  "error_correction": "H",
  "style": {"theme": "editorial"},
  "privacy": {"allow_raw_payload_in_manifest": false}
}
